{
  "content_policy": "dcrypt-fuzzing-artifact-closure-v1",
  "files": [
    {
      "kind": "reviewed-source",
      "path": "README.md",
      "sha256": "f135d0d3f567737672855c118c242c20ddc6da254c8cd718f788e06781c982cc",
      "size": 7425
    },
    {
      "kind": "generated",
      "path": "ROW-COVERAGE.md",
      "sha256": "f15c90d6146b960af679872b70ff4c78acaac493657064f8a1a8ab94bf7487ce",
      "size": 1303
    },
    {
      "kind": "generated",
      "path": "campaign-status.json",
      "sha256": "65d3125b7a2d5a3a7afedd09ca89761b0033c8e0d20635adfad11f2ebc5933e8",
      "size": 54842
    },
    {
      "kind": "reviewed-source",
      "path": "compiler_probe.py",
      "sha256": "191e00c205b11ebaed71464b46628786f5122e1de9d51d37a5e8bf44f463cefd",
      "size": 49700
    },
    {
      "kind": "generated",
      "path": "corpus-manifest.json",
      "sha256": "d4806baa411ebd2f12faa63cfbd9317dfff1e585a2e3a685208e752d5402e377",
      "size": 172485
    },
    {
      "kind": "generated",
      "path": "crash-bundle-template.json",
      "sha256": "fa7afa0dec1ee458f3502ab949a0e77301ed3e9d8b4fdecc3029402d4d63d2ab",
      "size": 2532
    },
    {
      "kind": "generated",
      "path": "crash-lifecycle-status.json",
      "sha256": "a158cee3b9f807f29d05b26f040233ce5b958aa066b62c5e2eb34ef25859bc52",
      "size": 3784
    },
    {
      "kind": "reviewed-source",
      "path": "crash_lifecycle.py",
      "sha256": "b90bbb5d61ba93d63c3d38c908a8e8c304bd1f883f042328d1f5027e4b858d04",
      "size": 42818
    },
    {
      "kind": "reviewed-source",
      "path": "fuzzing_lib.py",
      "sha256": "677e298f1affbc54df1d737246cf06c873c2a794d63eab0178f8550c8e26eeee",
      "size": 118759
    },
    {
      "kind": "reviewed-source",
      "path": "generate.py",
      "sha256": "be4f470e7a96dafa39610be016185cc86ab6f609a598a71837a88daface8a54f",
      "size": 7107
    },
    {
      "kind": "generated",
      "path": "local-sanitizer-requirements.json",
      "sha256": "966bba269f0d5bfaa37009aac94be05460fe03ad30b3d7ed3530857a15c66edd",
      "size": 3496
    },
    {
      "kind": "generated",
      "path": "policy.json",
      "sha256": "e34ca2a2e80add8731b544c6832f103cf873b321b0813fec229a7fe832a06a39",
      "size": 3844
    },
    {
      "kind": "reviewed-source",
      "path": "rebind-final-subject.py",
      "sha256": "f2e7e5c0708922df89e3e336bf8fa0d3a640f368194e13876fb73ef04c334300",
      "size": 79946
    },
    {
      "kind": "generated",
      "path": "row-mapping.json",
      "sha256": "0e4c1eb42515985d374518b33a24072b03a1bea4f5a2e9aa61c9dc426436aedf",
      "size": 7422246
    },
    {
      "kind": "reviewed-source",
      "path": "run-fuzz-smoke.py",
      "sha256": "976addcbdbad97110c511892b7228ec84ef51db3886cb0446c0c622bf93422b1",
      "size": 31596
    },
    {
      "kind": "generated",
      "path": "sanitizer-controls.json",
      "sha256": "69b50f4eedf8f143c36c3cd7ea6e3a19a011b40a8d2fa13d8ce01fb7121b0ea1",
      "size": 5070
    },
    {
      "kind": "reviewed-source",
      "path": "sanitizer_positive.py",
      "sha256": "eec0bf45eade2a71aecda803f3b1207deb75704645c6734b76af048a952f5322",
      "size": 10459
    },
    {
      "kind": "reviewed-source",
      "path": "schemas.py",
      "sha256": "bc06dced410b1c5a89adb1baecdd325fedf5e76b88e1839f413720b09630d0aa",
      "size": 22037
    },
    {
      "kind": "generated",
      "path": "schemas/artifacts.schema.json",
      "sha256": "79b98727a76bc513ee404651977295a982cd518adcafc8d0f512cfd71ba3f656",
      "size": 1488
    },
    {
      "kind": "generated",
      "path": "schemas/campaign-status.schema.json",
      "sha256": "f18bf15d702491ae5681db539b7536f143f7a42364f4d68a6617deea56367b80",
      "size": 29988
    },
    {
      "kind": "generated",
      "path": "schemas/corpus-manifest.schema.json",
      "sha256": "84ef16ecada4e9dcda084d64786cbe3c72de11ce50b7e0d9c5b55e6380334d40",
      "size": 32288
    },
    {
      "kind": "generated",
      "path": "schemas/crash-bundle-template.schema.json",
      "sha256": "db78a4e6bde65f12134fc64cdf818f31c8eef42657bd8230e49202805556bd81",
      "size": 19358
    },
    {
      "kind": "generated",
      "path": "schemas/crash-lifecycle-status.schema.json",
      "sha256": "9759a69d702f50fc607d3fad54c7bbd0e3b5a7674ea8c387a2a85a5a20105bd9",
      "size": 23117
    },
    {
      "kind": "generated",
      "path": "schemas/local-sanitizer-requirements.schema.json",
      "sha256": "8f49f5675948f4a2832f4e3431af372b5273ef7104095110d883c05ecbf156d9",
      "size": 7094
    },
    {
      "kind": "generated",
      "path": "schemas/policy.schema.json",
      "sha256": "7cb6d07031d58ec0f4c8e10a9eba894b5db2f784d3d88e33e0ba3e6797ee51c6",
      "size": 13671
    },
    {
      "kind": "generated",
      "path": "schemas/row-mapping.schema.json",
      "sha256": "efd183bc85c26b722b2855d062eadfcb0d5588fdea382e1415076f91f3faa6c4",
      "size": 9478
    },
    {
      "kind": "generated",
      "path": "schemas/sanitizer-controls.schema.json",
      "sha256": "4e9a68daea52d8b882fa10ec12f433884bffdf75b7fc077e027025eff590e73d",
      "size": 10142
    },
    {
      "kind": "generated",
      "path": "schemas/source-bindings.schema.json",
      "sha256": "9e6965af84fde84baeed382f1b682e8f2ebcc1bf657a6ded663b777c7878df44",
      "size": 2640
    },
    {
      "kind": "generated",
      "path": "schemas/target-registry.schema.json",
      "sha256": "38a8693227a257281528555802487ee84e99bfaa6745965223e7e949ca90799a",
      "size": 50707
    },
    {
      "kind": "reviewed-source",
      "path": "select-fuzz-targets.py",
      "sha256": "f0cd877aab32883de7c0026cce1b6d1d3c240e77a01f758a63e9b8704049726c",
      "size": 4600
    },
    {
      "kind": "reviewed-source",
      "path": "selftest.py",
      "sha256": "6f2124c344fbc9ad797a7068f73040f5f3a48e2f413fe5a413880ddafcf95bd3",
      "size": 80262
    },
    {
      "kind": "generated",
      "path": "source-bindings.json",
      "sha256": "e5569df1154d935d6857bb09beee3e5441284b14342e5af8f78aa2bcde86ce6d",
      "size": 5200
    },
    {
      "kind": "generated",
      "path": "target-registry.json",
      "sha256": "f9182aa95ff3e7d4db93f15c04a17f593273453d069df496dd2dd4bdeef1772b",
      "size": 34504
    },
    {
      "kind": "reviewed-source",
      "path": "verify.py",
      "sha256": "b3b644540bfe0046659f209f5af93e222b9a87570568f28acb6c17accd67a44f",
      "size": 8430
    }
  ],
  "release_gate": "HOLD",
  "schema_version": 1,
  "status": "STABLE-final-subject-bound"
}
